{
  "model": "EleutherAI/pythia-1.4b",
  "experiment": "checkpoint_dynamics",
  "n_layers": 24,
  "hidden_dim": 2048,
  "heads": 16,
  "architecture_class": "24L_16H",
  "expected_status": "collapsed",
  "protocol": {
    "layer_select_seed": 42,
    "eval_seeds": [
      43,
      44,
      45,
      46,
      47,
      48,
      49
    ],
    "oc_seeds": [
      43,
      44,
      45
    ],
    "target_ex_per_dim": 350,
    "batch_size": 48,
    "layers_per_pass": 4,
    "n_checkpoints": 10,
    "tokens_per_step": 2097152
  },
  "checkpoints": {
    "step256": {
      "step": 256,
      "tokens_seen": 536870912,
      "revision": "2ab90f690dd8ef9c52c061c0f43b584ac56b4430",
      "layer_profile": {
        "0": 0.2692756912212926,
        "1": 0.2815100376042436,
        "2": 0.28614338965684694,
        "3": 0.2877118719887817,
        "4": 0.2893060012973451,
        "5": 0.2886370769427881,
        "6": 0.2910469639503686,
        "7": 0.2935685268626775,
        "8": 0.29509685311802963,
        "9": 0.29478637314926737,
        "10": 0.29537124030270306,
        "11": 0.29556699005816434,
        "12": 0.2970367573863028,
        "13": 0.29698769413054,
        "14": 0.2972870603208937,
        "15": 0.29856050901168174,
        "16": 0.2989360868483452,
        "17": 0.29988651440824315,
        "18": 0.2986909096985725,
        "19": 0.29870730525978084,
        "20": 0.29850755379130195,
        "21": 0.29822452575542385,
        "22": 0.2987282196651451,
        "23": 0.2981332650068783
      },
      "peak_layer": 17,
      "peak_layer_frac": 0.71,
      "partial_corr": {
        "mean": 0.2973904581345117,
        "std": 0.002235022735815485,
        "per_seed": [
          0.2923914057465027,
          0.29996715682417424,
          0.2976217804799094,
          0.298784713024583,
          0.2981030982142013,
          0.29807616186633074,
          0.2967888907858805
        ],
        "seed_agreement": 0.9728901752459114
      },
      "output_controlled": {
        "mean": 0.06513337089083543,
        "per_seed": [
          0.05786373713683937,
          0.06433592505879639,
          0.07320045047687053
        ]
      },
      "mean_loss": 7.415119171142578,
      "perplexity": 1660.907088798819,
      "timing": {
        "load_s": 3.8,
        "sweep_s": 2406.1,
        "eval_s": 1351.0
      }
    },
    "step1000": {
      "step": 1000,
      "tokens_seen": 2097152000,
      "revision": "4ccfb66b5ff79d332c69d5182d88d8de8b3441d3",
      "layer_profile": {
        "0": 0.19606365229092962,
        "1": 0.22331803960782112,
        "2": 0.23522797937632364,
        "3": 0.24131743373137604,
        "4": 0.26153403562146343,
        "5": 0.27105546458732865,
        "6": 0.2779724346104668,
        "7": 0.28221780864784957,
        "8": 0.28642686046695476,
        "9": 0.2888885663038797,
        "10": 0.29175671011891924,
        "11": 0.2917482371480396,
        "12": 0.29020667973026537,
        "13": 0.2885809554108451,
        "14": 0.2976486257694021,
        "15": 0.3062837137970943,
        "16": 0.31034900314346214,
        "17": 0.313022243125664,
        "18": 0.31307613867279377,
        "19": 0.31275866045627515,
        "20": 0.3104487552787822,
        "21": 0.30979067794321946,
        "22": 0.3097043952501534,
        "23": 0.3066937669644679
      },
      "peak_layer": 18,
      "peak_layer_frac": 0.75,
      "partial_corr": {
        "mean": 0.3141893404355662,
        "std": 0.0011115750007520734,
        "per_seed": [
          0.31336757312988184,
          0.31294038489114917,
          0.3143095667292747,
          0.3157866816988538,
          0.31549828149855486,
          0.3127954895764185,
          0.3146274055248306
        ],
        "seed_agreement": 0.977297612989977
      },
      "output_controlled": {
        "mean": 0.11281277326421718,
        "per_seed": [
          0.11550921275238381,
          0.1117812924474521,
          0.11114781459281566
        ]
      },
      "mean_loss": 4.914906978607178,
      "perplexity": 136.30662978024398,
      "timing": {
        "load_s": 30.7,
        "sweep_s": 2504.7,
        "eval_s": 1207.1
      }
    },
    "step2000": {
      "step": 2000,
      "tokens_seen": 4194304000,
      "revision": "e12c050231d0990e07cdfa54506cb1e69a9657e4",
      "layer_profile": {
        "0": 0.15555315028825062,
        "1": 0.15917532909289314,
        "2": 0.15818816478333264,
        "3": 0.15389249612955602,
        "4": 0.15607638243298508,
        "5": 0.16382960660715834,
        "6": 0.1874850221764427,
        "7": 0.1923089648784653,
        "8": 0.1982070409269894,
        "9": 0.21263385121942724,
        "10": 0.21416062027863414,
        "11": 0.2181645120712751,
        "12": 0.22075035868856477,
        "13": 0.23022631799902898,
        "14": 0.2201364737594099,
        "15": 0.21651192124030494,
        "16": 0.21715500269369006,
        "17": 0.21631834045596893,
        "18": 0.2087238796840662,
        "19": 0.18309101632428545,
        "20": 0.17723137857951385,
        "21": 0.18672504307335633,
        "22": 0.19615451642452636,
        "23": 0.21482840749459817
      },
      "peak_layer": 13,
      "peak_layer_frac": 0.54,
      "partial_corr": {
        "mean": 0.23065638206246028,
        "std": 0.0018966469219798276,
        "per_seed": [
          0.23059784153925517,
          0.23010015411218268,
          0.23048239577621618,
          0.23434499795927438,
          0.22892913362005415,
          0.22812572307331672,
          0.23201442835692285
        ],
        "seed_agreement": 0.9697943482041305
      },
      "output_controlled": {
        "mean": 0.057261394394265384,
        "per_seed": [
          0.059057836372570637,
          0.059904360100308134,
          0.05282198670991736
        ]
      },
      "mean_loss": 4.123239040374756,
      "perplexity": 61.758958405276054,
      "timing": {
        "load_s": 17.5,
        "sweep_s": 2333.3,
        "eval_s": 1267.4
      }
    },
    "step4000": {
      "step": 4000,
      "tokens_seen": 8388608000,
      "revision": "e27c7a8944677b79afa3da836d8be00346511c9f",
      "layer_profile": {
        "0": 0.14780232793414003,
        "1": 0.15289811357968988,
        "2": 0.1539166651887399,
        "3": 0.1616891715710028,
        "4": 0.17296872270182645,
        "5": 0.17366265496615332,
        "6": 0.19373321575471011,
        "7": 0.2109906646093664,
        "8": 0.2338244789039424,
        "9": 0.24361736667985082,
        "10": 0.25547350565012217,
        "11": 0.254054990246458,
        "12": 0.252373965895927,
        "13": 0.2539992408991469,
        "14": 0.25097658413012214,
        "15": 0.24851167689119086,
        "16": 0.24316046072115186,
        "17": 0.2373361073923164,
        "18": 0.2275234409726979,
        "19": 0.21752290757442116,
        "20": 0.20915728305020784,
        "21": 0.2040058795835799,
        "22": 0.18009952306252933,
        "23": 0.20320310690613433
      },
      "peak_layer": 10,
      "peak_layer_frac": 0.42,
      "partial_corr": {
        "mean": 0.253614696626086,
        "std": 0.004337924843793172,
        "per_seed": [
          0.24794762793153155,
          0.24886343780035092,
          0.25742854630682444,
          0.25895751203505457,
          0.25131545723280596,
          0.2587354601780314,
          0.2520548348980031
        ],
        "seed_agreement": 0.9633533151734002
      },
      "output_controlled": {
        "mean": 0.09839196907090492,
        "per_seed": [
          0.10083331023013162,
          0.096573402800021,
          0.09776919418256214
        ]
      },
      "mean_loss": 3.696547508239746,
      "perplexity": 40.30790115771384,
      "timing": {
        "load_s": 22.5,
        "sweep_s": 2476.5,
        "eval_s": 1350.6
      }
    },
    "step8000": {
      "step": 8000,
      "tokens_seen": 16777216000,
      "revision": "772eca29f926856669a401fc662cc199f04352ce",
      "layer_profile": {
        "0": 0.12520801209916624,
        "1": 0.129229091617642,
        "2": 0.14157496119379814,
        "3": 0.12368488293296367,
        "4": 0.11759885671376487,
        "5": 0.12510541860504534,
        "6": 0.1451272442117062,
        "7": 0.1568884923525866,
        "8": 0.14650622922444898,
        "9": 0.14886503390583783,
        "10": 0.15637700489592402,
        "11": 0.15992810345602937,
        "12": 0.155437391290468,
        "13": 0.15649206473989755,
        "14": 0.1544232707693122,
        "15": 0.15269687313676217,
        "16": 0.14631666992234107,
        "17": 0.1439551080872184,
        "18": 0.14126092059553005,
        "19": 0.13684102791386282,
        "20": 0.13589758665007443,
        "21": 0.13488241282948113,
        "22": 0.15306775343321405,
        "23": 0.13910836285215428
      },
      "peak_layer": 11,
      "peak_layer_frac": 0.46,
      "partial_corr": {
        "mean": 0.15569600813413756,
        "std": 0.007433559890388354,
        "per_seed": [
          0.14864788728199138,
          0.15843752972114122,
          0.16036200842551726,
          0.1614988892783542,
          0.14264463119565485,
          0.16546904264797252,
          0.1528120683883314
        ],
        "seed_agreement": 0.9399270426632843
      },
      "output_controlled": {
        "mean": 0.0370285490379532,
        "per_seed": [
          0.025505425096914516,
          0.044289386574818866,
          0.041290835442126216
        ]
      },
      "mean_loss": 3.4130167961120605,
      "perplexity": 30.356686192094394,
      "timing": {
        "load_s": 20.9,
        "sweep_s": 2695.3,
        "eval_s": 1179.1
      }
    },
    "step16000": {
      "step": 16000,
      "tokens_seen": 33554432000,
      "revision": "7227add89b788c09c721b976969beb64fa71d10c",
      "layer_profile": {
        "0": 0.09607332005500817,
        "1": 0.09493788445753909,
        "2": 0.0940222658184752,
        "3": 0.09964359356052274,